{
  "schemaVersion": "1",
  "executionMode": "REFERENCE_EXPECTATION_NOT_OPA",
  "adapterId": "fixture-baseline",
  "total": 41,
  "matches": 25,
  "drifts": 16,
  "errors": 0,
  "records": [
    {
      "caseId": "G01",
      "input": {
        "daysSincePurchase": 3,
        "usageBasisPoints": 500,
        "promotionalPurchase": false,
        "finalSale": false,
        "managerApproved": false,
        "planType": "MONTHLY"
      },
      "expected": {
        "decision": "ALLOW",
        "matchedRuleId": "refund-eligible",
        "explanation": "The request is within the inclusive refund thresholds.",
        "policyVersion": 4
      },
      "actual": {
        "decision": "ALLOW",
        "matchedRuleId": null,
        "explanation": "Fixture returned a decision without trace metadata."
      },
      "relatedClauseIds": [
        "clause-2db0db31"
      ],
      "relatedRuleIds": [
        "refund-eligible"
      ],
      "status": "MATCH",
      "defectIds": []
    },
    {
      "caseId": "G02",
      "input": {
        "daysSincePurchase": 20,
        "usageBasisPoints": 0,
        "promotionalPurchase": false,
        "finalSale": false,
        "managerApproved": false,
        "planType": "ANNUAL"
      },
      "expected": {
        "decision": "DENY",
        "matchedRuleId": null,
        "explanation": "No explicit rule matched; applied the candidate default decision.",
        "policyVersion": 4
      },
      "actual": {
        "decision": "DENY",
        "matchedRuleId": null,
        "explanation": "Fixture returned a decision without trace metadata."
      },
      "relatedClauseIds": [
        "clause-2db0db31"
      ],
      "relatedRuleIds": [],
      "status": "MATCH",
      "defectIds": []
    },
    {
      "caseId": "G03",
      "input": {
        "daysSincePurchase": 2,
        "usageBasisPoints": 0,
        "promotionalPurchase": true,
        "finalSale": false,
        "managerApproved": false,
        "planType": "MONTHLY"
      },
      "expected": {
        "decision": "REVIEW",
        "matchedRuleId": "promotion-review",
        "explanation": "The eligible promotional request awaits a manager decision.",
        "policyVersion": 4
      },
      "actual": {
        "decision": "REVIEW",
        "matchedRuleId": null,
        "explanation": "Fixture returned a decision without trace metadata."
      },
      "relatedClauseIds": [
        "clause-68b8918e",
        "clause-83647cb3"
      ],
      "relatedRuleIds": [
        "promotion-review"
      ],
      "status": "MATCH",
      "defectIds": []
    },
    {
      "caseId": "G04",
      "input": {
        "daysSincePurchase": 2,
        "usageBasisPoints": 0,
        "promotionalPurchase": true,
        "finalSale": false,
        "managerApproved": true,
        "planType": "ENTERPRISE"
      },
      "expected": {
        "decision": "ALLOW",
        "matchedRuleId": "promotion-approved",
        "explanation": "The eligible promotional request has manager approval.",
        "policyVersion": 4
      },
      "actual": {
        "decision": "ALLOW",
        "matchedRuleId": null,
        "explanation": "Fixture returned a decision without trace metadata."
      },
      "relatedClauseIds": [
        "clause-2db0db31",
        "clause-68b8918e"
      ],
      "relatedRuleIds": [
        "promotion-approved"
      ],
      "status": "MATCH",
      "defectIds": []
    },
    {
      "caseId": "G05",
      "input": {
        "daysSincePurchase": 2,
        "usageBasisPoints": 0,
        "promotionalPurchase": false,
        "finalSale": true,
        "managerApproved": false,
        "planType": "MONTHLY"
      },
      "expected": {
        "decision": "DENY",
        "matchedRuleId": "final-sale-deny",
        "explanation": "Final-sale purchases are not refundable.",
        "policyVersion": 4
      },
      "actual": {
        "decision": "DENY",
        "matchedRuleId": null,
        "explanation": "Fixture returned a decision without trace metadata."
      },
      "relatedClauseIds": [
        "clause-c74dd597"
      ],
      "relatedRuleIds": [
        "final-sale-deny"
      ],
      "status": "MATCH",
      "defectIds": []
    },
    {
      "caseId": "G06",
      "input": {
        "daysSincePurchase": 2,
        "usageBasisPoints": 0,
        "promotionalPurchase": true,
        "finalSale": true,
        "managerApproved": true,
        "planType": "ANNUAL"
      },
      "expected": {
        "decision": "DENY",
        "matchedRuleId": "final-sale-deny",
        "explanation": "Final-sale purchases are not refundable.",
        "policyVersion": 4
      },
      "actual": {
        "decision": "ALLOW",
        "matchedRuleId": null,
        "explanation": "Fixture returned a decision without trace metadata."
      },
      "relatedClauseIds": [
        "clause-c74dd597",
        "clause-2db0db31",
        "clause-68b8918e"
      ],
      "relatedRuleIds": [
        "final-sale-deny",
        "promotion-approved"
      ],
      "status": "DRIFT",
      "defectIds": [
        "FINAL_SALE_PRECEDENCE"
      ]
    },
    {
      "caseId": "D01",
      "input": {
        "daysSincePurchase": 14,
        "usageBasisPoints": 500,
        "promotionalPurchase": false,
        "finalSale": false,
        "managerApproved": false,
        "planType": "MONTHLY"
      },
      "expected": {
        "decision": "ALLOW",
        "matchedRuleId": "refund-eligible",
        "explanation": "The request is within the inclusive refund thresholds.",
        "policyVersion": 4
      },
      "actual": {
        "decision": "DENY",
        "matchedRuleId": null,
        "explanation": "Fixture returned a decision without trace metadata."
      },
      "relatedClauseIds": [
        "clause-2db0db31"
      ],
      "relatedRuleIds": [
        "refund-eligible"
      ],
      "status": "DRIFT",
      "defectIds": [
        "DAY_14_INCLUSIVE"
      ]
    },
    {
      "caseId": "D02",
      "input": {
        "daysSincePurchase": 3,
        "usageBasisPoints": 2000,
        "promotionalPurchase": false,
        "finalSale": false,
        "managerApproved": false,
        "planType": "ANNUAL"
      },
      "expected": {
        "decision": "ALLOW",
        "matchedRuleId": "refund-eligible",
        "explanation": "The request is within the inclusive refund thresholds.",
        "policyVersion": 4
      },
      "actual": {
        "decision": "DENY",
        "matchedRuleId": null,
        "explanation": "Fixture returned a decision without trace metadata."
      },
      "relatedClauseIds": [
        "clause-2db0db31"
      ],
      "relatedRuleIds": [
        "refund-eligible"
      ],
      "status": "DRIFT",
      "defectIds": [
        "USAGE_2000_INCLUSIVE"
      ]
    },
    {
      "caseId": "D03",
      "input": {
        "daysSincePurchase": 2,
        "usageBasisPoints": 500,
        "promotionalPurchase": true,
        "finalSale": true,
        "managerApproved": true,
        "planType": "ENTERPRISE"
      },
      "expected": {
        "decision": "DENY",
        "matchedRuleId": "final-sale-deny",
        "explanation": "Final-sale purchases are not refundable.",
        "policyVersion": 4
      },
      "actual": {
        "decision": "ALLOW",
        "matchedRuleId": null,
        "explanation": "Fixture returned a decision without trace metadata."
      },
      "relatedClauseIds": [
        "clause-c74dd597",
        "clause-2db0db31",
        "clause-68b8918e"
      ],
      "relatedRuleIds": [
        "final-sale-deny",
        "promotion-approved"
      ],
      "status": "DRIFT",
      "defectIds": [
        "FINAL_SALE_PRECEDENCE"
      ]
    },
    {
      "caseId": "C-BOUNDARY-abce7966",
      "input": {
        "daysSincePurchase": 13,
        "usageBasisPoints": 1999,
        "promotionalPurchase": false,
        "finalSale": false,
        "managerApproved": false,
        "planType": "MONTHLY"
      },
      "expected": {
        "decision": "ALLOW",
        "matchedRuleId": "refund-eligible",
        "explanation": "The request is within the inclusive refund thresholds.",
        "policyVersion": 4
      },
      "actual": {
        "decision": "ALLOW",
        "matchedRuleId": null,
        "explanation": "Fixture returned a decision without trace metadata."
      },
      "relatedClauseIds": [
        "clause-2db0db31"
      ],
      "relatedRuleIds": [
        "refund-eligible"
      ],
      "status": "MATCH",
      "defectIds": []
    },
    {
      "caseId": "C-MINIMAL_CONTRAST-44e23079",
      "input": {
        "daysSincePurchase": 13,
        "usageBasisPoints": 1999,
        "promotionalPurchase": true,
        "finalSale": false,
        "managerApproved": false,
        "planType": "MONTHLY"
      },
      "expected": {
        "decision": "REVIEW",
        "matchedRuleId": "promotion-review",
        "explanation": "The eligible promotional request awaits a manager decision.",
        "policyVersion": 4
      },
      "actual": {
        "decision": "REVIEW",
        "matchedRuleId": null,
        "explanation": "Fixture returned a decision without trace metadata."
      },
      "relatedClauseIds": [
        "clause-2db0db31",
        "clause-68b8918e",
        "clause-83647cb3"
      ],
      "relatedRuleIds": [
        "promotion-review"
      ],
      "status": "MATCH",
      "defectIds": []
    },
    {
      "caseId": "C-MINIMAL_CONTRAST-1894e746",
      "input": {
        "daysSincePurchase": 13,
        "usageBasisPoints": 1999,
        "promotionalPurchase": true,
        "finalSale": false,
        "managerApproved": true,
        "planType": "MONTHLY"
      },
      "expected": {
        "decision": "ALLOW",
        "matchedRuleId": "promotion-approved",
        "explanation": "The eligible promotional request has manager approval.",
        "policyVersion": 4
      },
      "actual": {
        "decision": "ALLOW",
        "matchedRuleId": null,